{
  "schema_version": "0.1",
  "id": "FEAT-order-create",
  "type": "service_feature",
  "name": "주문 생성",
  "generated_by": "feature-tracer",
  "commit": "a1b2c3d",
  "overview": "주문 페이지의 제출 버튼이 POST /orders를 호출하고, OrderService가 재고 차감과 주문 저장을 하나의 트랜잭션으로 처리한다.",
  "layers": ["frontend", "backend", "db"],
  "steps": [
    {
      "order": 1,
      "layer": "frontend",
      "description": "handleSubmit이 장바구니 상태를 요청 본문으로 만들어 POST /orders 호출",
      "evidence": [{ "file": "frontend/src/pages/OrderPage.tsx", "lines": "30-52", "symbol": "handleSubmit" }]
    },
    {
      "order": 2,
      "layer": "backend",
      "description": "OrderController.createOrder가 요청을 검증 후 OrderService.create로 위임",
      "evidence": [{ "file": "backend/order/OrderController.java", "lines": "18-35", "symbol": "createOrder" }]
    },
    {
      "order": 3,
      "layer": "db",
      "description": "재고 차감과 주문 저장을 단일 트랜잭션에서 수행",
      "evidence": [{ "file": "backend/order/OrderService.java", "lines": "45-78", "symbol": "create" }],
      "claim_refs": ["FEAT-order-create#01"]
    }
  ],
  "claims": [
    {
      "id": "FEAT-order-create#01",
      "statement": "주문 생성 시 재고 차감과 주문 저장이 하나의 트랜잭션으로 묶여 있다",
      "evidence": [{ "file": "backend/order/OrderService.java", "lines": "45-78", "symbol": "create" }],
      "verification": "static_only",
      "confidence": "high",
      "agent": "feature-tracer",
      "related": ["TECH-transaction"]
    },
    {
      "id": "FEAT-order-create#02",
      "statement": "재고 부족 시 예외를 던지고 프론트에서 토스트 메시지로 표시한다",
      "evidence": [
        { "file": "backend/order/OrderService.java", "lines": "80-92" },
        { "file": "frontend/src/pages/OrderPage.tsx", "lines": "55-70" }
      ],
      "verification": "static_only",
      "confidence": "medium",
      "agent": "feature-tracer"
    }
  ],
  "open_questions": [
    {
      "question": "재고 차감 시 동시 주문에 대한 락 전략이 의도적으로 생략된 것인가?",
      "reason": "unclear_intent",
      "related_claims": ["FEAT-order-create#01"]
    }
  ]
}
